{
    "$schema": "https://json-schema.org/draft/2020-12/schema",
    "$id": "https://raw.githubusercontent.com/StefanGreve/profile/master/profile.config.schema.json",
    "title": "PowerShell Profile Settings",
    "description": "Configuration for the PowerShell profile, read from the profile.config.json next to profile.ps1.",
    "type": "object",
    "additionalProperties": false,
    "properties": {
        "$schema": {
            "type": "string",
            "description": "Reference to this JSON schema."
        },
        "DefaultCulture": {
            "type": "string",
            "description": "Culture applied to the session via [CultureInfo]::CurrentCulture. Use a culture name such as en-US, or an empty string for the invariant culture.",
            "pattern": "^$|^[A-Za-z]{2,3}(-[A-Za-z0-9]{2,8})*$",
            "default": "en-US",
            "examples": [ "en-US", "de-DE", "ja-JP" ]
        },
        "DefaultEncoding": {
            "type": "string",
            "description": "Default -Encoding applied to Cmdlets via $PSDefaultParameterValues. Accepts the values supported by PowerShell 7.1 and higher.",
            "enum": [
                "ascii",
                "ansi",
                "bigendianunicode",
                "bigendianutf32",
                "oem",
                "unicode",
                "utf7",
                "utf8",
                "utf8BOM",
                "utf8NoBOM",
                "utf32"
            ],
            "default": "utf8"
        },
        "DotSourceDirectory": {
            "type": "string",
            "description": "Directory whose *.ps1 scripts are dot-sourced on profile launch. A warning is emitted when the path does not exist."
        },
        "EnableClassicProgressbar": {
            "type": "boolean",
            "description": "Use the classic progress bar view with a cyan background and yellow text instead of the default minimal view.",
            "default": false
        },
        "Modules": {
            "type": "array",
            "description": "PowerShell module names to import on profile launch. A warning is emitted for any module that is not installed.",
            "items": {
                "type": "string"
            },
            "uniqueItems": true,
            "default": [ "PowerTools" ]
        },
        "RegisterNativeCompletions": {
            "type": "array",
            "description": "Native command-line tools to register argument completers for on profile launch. Each tool is only registered when it is also installed.",
            "items": {
                "type": "string",
                "enum": [ "bat", "delta", "deno", "dotnet", "dotnet-suggest", "gh", "op", "pip", "rustup", "uv", "winget" ]
            },
            "uniqueItems": true
        },
        "Prompt": {
            "type": "object",
            "description": "Toggles for optional segments of the command prompt.",
            "additionalProperties": false,
            "properties": {
                "EnableBatteryStatus": {
                    "type": "boolean",
                    "description": "Display the remaining battery charge while running on battery power.",
                    "default": false
                },
                "EnableGitUserName": {
                    "type": "boolean",
                    "description": "Display the active Git user name next to the branch name.",
                    "default": false
                },
                "EnableTimestamp": {
                    "type": "boolean",
                    "description": "Display the current wall-clock time (HH:mm:ss) next to the elapsed execution time.",
                    "default": false
                }
            }
        }
    }
}
