{
    "$schema": "https://raw.githubusercontent.com/StefanGreve/profile/master/profile.config.schema.json",
    "DefaultCulture": "en-US",
    "DefaultEncoding": "utf8",
    "DotSourceDirectory": "~/Documents/Scripts",
    "EnableClassicProgressbar": true,
    "Modules": [
        "PowerTools"
    ],
    "Prompt": {
        "EnableBatteryStatus": false,
        "EnableGitUserName": true,
        "EnableTimestamp": false
    },
    "RegisterNativeCompletions": [
        "winget"
    ]
}
